{
  "schema_version": "0.1.0",
  "observed_on": "2026-09-22",
  "snapshot_id": "new-repositories-census-2026-09-22",
  "records": [
    {
      "repository_full_name": "Loofy147/adaptive-reasoning-os",
      "ref": "main",
      "commit": "5ef38bf8bf96ba98f8c39a643c0350ceb3b30616",
      "provenance": {
        "fork": false,
        "parent": null,
        "source": null,
        "status": "first_party_candidate"
      },
      "observations": {
        "visibility": "public",
        "archived": false,
        "size_kb": 18,
        "root_signals": [
          "RESEARCH_BASELINE.md",
          "experiments/",
          "main research protocol"
        ],
        "tests": "present",
        "ci": "present"
      },
      "triage": {
        "maturity_signal": "research_baseline_signal",
        "review_priority": "high",
        "route": "DEEP_REVIEW",
        "notes": "Directly overlaps the portfolio's evidence/selection/verification research line; controlled experiments are the next useful boundary."
      },
      "epistemic": {
        "status": "observed",
        "assessed_at": "2026-09-22"
      },
      "evidence_refs": [
        "GitHub repository metadata: Loofy147/adaptive-reasoning-os",
        "Loofy147/adaptive-reasoning-os@5ef38bf8bf96ba98f8c39a643c0350ceb3b30616: root tree",
        "Loofy147/adaptive-reasoning-os@5ef38bf8bf96ba98f8c39a643c0350ceb3b30616: README/manifest surfaces where present"
      ]
    },
    {
      "repository_full_name": "Loofy147/ledger-system-source-of-truth",
      "ref": "main",
      "commit": "e63a92171f6c5b3a4958157be979347857f6a809",
      "provenance": {
        "fork": false,
        "parent": null,
        "source": null,
        "status": "first_party_candidate"
      },
      "observations": {
        "visibility": "private",
        "archived": false,
        "size_kb": 41,
        "root_signals": [
          "ledger.py",
          "mcp_adapter/",
          "hub_adapter/",
          "docs/schema.md",
          "protocol tests"
        ],
        "tests": "present",
        "ci": "unknown"
      },
      "triage": {
        "maturity_signal": "substantial",
        "review_priority": "high",
        "route": "DEEP_REVIEW",
        "notes": "Concrete reusable contradiction/decision ledger with explicit limitations and adapters."
      },
      "epistemic": {
        "status": "observed",
        "assessed_at": "2026-09-22"
      },
      "evidence_refs": [
        "GitHub repository metadata: Loofy147/ledger-system-source-of-truth",
        "Loofy147/ledger-system-source-of-truth@e63a92171f6c5b3a4958157be979347857f6a809: root tree",
        "Loofy147/ledger-system-source-of-truth@e63a92171f6c5b3a4958157be979347857f6a809: README/manifest surfaces where present"
      ]
    },
    {
      "repository_full_name": "Loofy147/My_browser",
      "ref": "main",
      "commit": "402121c0e6cf9294d8e71feecd5752eade859807",
      "provenance": {
        "fork": false,
        "parent": null,
        "source": null,
        "status": "first_party_candidate"
      },
      "observations": {
        "visibility": "public",
        "archived": false,
        "size_kb": 155,
        "root_signals": [
          "package.json",
          "src/",
          "tests/",
          "fixtures/",
          "THREAT_MODEL.md",
          "evidence kernel"
        ],
        "tests": "present",
        "ci": "present"
      },
      "triage": {
        "maturity_signal": "substantial",
        "review_priority": "high",
        "route": "DEEP_REVIEW",
        "notes": "Evidence-oriented acquisition kernel with current CI gate and a clearly defined downstream experiment."
      },
      "epistemic": {
        "status": "observed",
        "assessed_at": "2026-09-22"
      },
      "evidence_refs": [
        "GitHub repository metadata: Loofy147/My_browser",
        "Loofy147/My_browser@402121c0e6cf9294d8e71feecd5752eade859807: root tree",
        "Loofy147/My_browser@402121c0e6cf9294d8e71feecd5752eade859807: README/manifest surfaces where present"
      ]
    },
    {
      "repository_full_name": "Loofy147/Compute-Qualification-Infrastructure",
      "ref": "main",
      "commit": "38964f3cd0e021b53b112001faaff3e10cb3bc8c",
      "provenance": {
        "fork": false,
        "parent": null,
        "source": null,
        "status": "first_party_candidate"
      },
      "observations": {
        "visibility": "public",
        "archived": false,
        "size_kb": 103,
        "root_signals": [
          "decisions/",
          "research/",
          "tools/",
          "explicit KILLED decision"
        ],
        "tests": "absent_verified",
        "ci": "absent_verified"
      },
      "triage": {
        "maturity_signal": "killed_research_artifact",
        "review_priority": "low",
        "route": "REFERENCE_ONLY",
        "notes": "Explicitly killed product opportunity; preserve research evidence and reopen only under stated conditions."
      },
      "epistemic": {
        "status": "observed",
        "assessed_at": "2026-09-22"
      },
      "evidence_refs": [
        "GitHub repository metadata: Loofy147/Compute-Qualification-Infrastructure",
        "Loofy147/Compute-Qualification-Infrastructure@38964f3cd0e021b53b112001faaff3e10cb3bc8c: root tree",
        "Loofy147/Compute-Qualification-Infrastructure@38964f3cd0e021b53b112001faaff3e10cb3bc8c: README/manifest surfaces where present"
      ]
    },
    {
      "repository_full_name": "Loofy147/Economic-luncher",
      "ref": "main",
      "commit": "afe257e6b15d875a9819c5405094b55b87211aa6",
      "provenance": {
        "fork": false,
        "parent": null,
        "source": null,
        "status": "first_party_candidate"
      },
      "observations": {
        "visibility": "public",
        "archived": false,
        "size_kb": 104,
        "root_signals": [
          "src/",
          "tests/",
          "configs/",
          "research/pricing_snapshots/",
          "pyproject.toml"
        ],
        "tests": "present",
        "ci": "absent_verified"
      },
      "triage": {
        "maturity_signal": "substantial",
        "review_priority": "medium",
        "route": "DEEP_REVIEW",
        "notes": "Reproducible economic-cost topology engine with dated vendor snapshots; relevant to infrastructure economics."
      },
      "epistemic": {
        "status": "observed",
        "assessed_at": "2026-09-22"
      },
      "evidence_refs": [
        "GitHub repository metadata: Loofy147/Economic-luncher",
        "Loofy147/Economic-luncher@afe257e6b15d875a9819c5405094b55b87211aa6: root tree",
        "Loofy147/Economic-luncher@afe257e6b15d875a9819c5405094b55b87211aa6: README/manifest surfaces where present"
      ]
    },
    {
      "repository_full_name": "Loofy147/Wedgettok-Next",
      "ref": "main",
      "commit": "ea7872521f05a00118b4c6337ba30213c5463902",
      "provenance": {
        "fork": false,
        "parent": null,
        "source": null,
        "status": "first_party_candidate"
      },
      "observations": {
        "visibility": "private",
        "archived": false,
        "size_kb": 329,
        "root_signals": [
          "React/Vite app",
          "large verify script",
          "CI",
          "ROADMAP.md"
        ],
        "tests": "present",
        "ci": "present"
      },
      "triage": {
        "maturity_signal": "substantial",
        "review_priority": "high",
        "route": "LINEAGE_REVIEW",
        "notes": "Likely a parallel/second-generation line adjacent to Wedgettok; requires content/history comparison before treating as separate or successor."
      },
      "epistemic": {
        "status": "observed",
        "assessed_at": "2026-09-22"
      },
      "evidence_refs": [
        "GitHub repository metadata: Loofy147/Wedgettok-Next",
        "Loofy147/Wedgettok-Next@ea7872521f05a00118b4c6337ba30213c5463902: root tree",
        "Loofy147/Wedgettok-Next@ea7872521f05a00118b4c6337ba30213c5463902: README/manifest surfaces where present"
      ]
    },
    {
      "repository_full_name": "Loofy147/METATRON",
      "ref": "main",
      "commit": "9dd2ee3daa33397453c76e9fcba446f117d22cb6",
      "provenance": {
        "fork": true,
        "parent": "sooryathejas/METATRON",
        "source": "sooryathejas/METATRON",
        "status": "external_fork"
      },
      "observations": {
        "visibility": "public",
        "archived": false,
        "size_kb": 2138,
        "root_signals": [
          "Python CLI",
          "local LLM",
          "recon tools",
          "MariaDB",
          "export/reporting"
        ],
        "tests": "unknown",
        "ci": "absent_verified"
      },
      "triage": {
        "maturity_signal": "external_reference",
        "review_priority": "medium",
        "route": "REFERENCE_ONLY",
        "notes": "External fork and security-sensitive tooling; do not treat as first-party implementation without provenance/reuse review."
      },
      "epistemic": {
        "status": "observed",
        "assessed_at": "2026-09-22"
      },
      "evidence_refs": [
        "GitHub repository metadata: Loofy147/METATRON",
        "Loofy147/METATRON@9dd2ee3daa33397453c76e9fcba446f117d22cb6: root tree",
        "Loofy147/METATRON@9dd2ee3daa33397453c76e9fcba446f117d22cb6: README/manifest surfaces where present"
      ]
    },
    {
      "repository_full_name": "Loofy147/algeria-digital-venture-operating-system",
      "ref": "main",
      "commit": "beb11e4bf1b6d949cb47ff5e73422271068da020",
      "provenance": {
        "fork": false,
        "parent": null,
        "source": null,
        "status": "first_party_candidate"
      },
      "observations": {
        "visibility": "private",
        "archived": false,
        "size_kb": 177,
        "root_signals": [
          "client/",
          "server/",
          "shared/",
          "package.json",
          "template.json"
        ],
        "tests": "unknown",
        "ci": "absent_verified"
      },